name,type,summary,state,updated,lat,lng,size,url,id,contained
Leland Complex,Wildfire,"The Leland Complex is composed of four wildfires: The Sand Mountain,...",IDAHO,2021-07-27 13:22:27,46.746,-116.628,"3,350 Acres",/incident/7644/,7644,67
Dixie Fire (CA),Wildfire," Yesterday, a thick covering of smoke over the area shaded the fire....",CALIFORNIA,2021-07-27 13:21:23,39.819,-121.419,"208,206 Acres",/incident/7690/,7690,23
Goat Fire,Wildfire,Fire activity increased Monday on the Goat Fire as it spotted to...,MONTANA,2021-07-27 13:08:45,46.369,-113.068,97 Acres,/incident/7694/,7694,0
Character Complex,Wildfire,"The Type 2 Northern Rockies Incident Management Team 3, Mike Almas,...",IDAHO,2021-07-27 13:06:49,47.645,-116.019,"5,174 Acres",/incident/7654/,7654,30
Summit Trail,Wildfire,The Summit Trail Fire was started by lightning on July 12 and is...,WASHINGTON,2021-07-27 13:05:04,48.285,-118.531,"13,767 Acres",/incident/7677/,7677,6
Park Fire,Wildfire,"The Park Fire was discovered Monday, July 26 at approximately 2 pm,...",CALIFORNIA,2021-07-27 12:58:30,36.2,-118.722,250 Acres,/incident/7726/,7726,5
Tamarack Fire,Wildfire,The Tamarack Fire started as a lightning strike in the Mokelumne...,NEVADA,2021-07-27 12:58:02,38.628,-119.857,"68,103 Acres",/incident/7674/,7674,54
Woods Creek Fire,Wildfire,"The Woods Creek Fire was discovered on Saturday, July 10 near Boulder...",MONTANA,2021-07-27 12:53:23,46.553,-111.356,"3,700 Acres",/incident/7649/,7649,0
Jack Fire,Wildfire,"The Jack Fire was reported at approximately 5:00 pm on July 5,...",OREGON,2021-07-27 12:42:56,43.322,-122.686,"22,609 Acres",/incident/7605/,7605,59
Cedar Creek,Wildfire,"Multiple fires were started by lightning on July 8, 2021 in the...",WASHINGTON,2021-07-27 12:40:31,48.595,-120.537,"33,462 Acres",/incident/7655/,7655,13
Green Ridge Fire,Wildfire,The Turkey Tail and Green Ridge fires began from lightning strikes...,OREGON,2021-07-27 12:33:27,46.134,-117.719,"6,799 Acres",/incident/7628/,7628,15
Lick Creek (Dry Gulch) Fire,Wildfire,"Lightning ignited several fires southwest of Asotin, WA on July 7....",OREGON,2021-07-27 12:30:16,46.262,-117.416,"80,392 Acres",/incident/7615/,7615,90
American Fork Fire,Wildfire,"The lightning-caused American Fork Fire started on July 17, 2021 in...",MONTANA,2021-07-27 12:28:19,46.165,-110.248,"8,379 Acres",/incident/7681/,7681,10
Henry Fire,Wildfire,"On June 24, 2021, a lightning storm ignited a fire in the...",CALIFORNIA,2021-07-27 12:27:45,38.465,-119.863,"1,320 Acres",/incident/7639/,7639,100
Dixie-Jumbo Fires (ID),Wildfire,"As of 6 a.m. (PDT) July 25, a Nez Perce-Clearwater National Forest's...",IDAHO,2021-07-27 12:25:42,45.586,-115.444,"38,571 Acres",/incident/7608/,7608,18
Divide Complex-Balsinger Fire,Wildfire,Cascade County Sheriff’s Office has issued an evacuation order for...,MONTANA,2021-07-27 12:24:13,46.993,-110.933,"6,722 Acres",/incident/7624/,7624,0
Bruler Fire,Wildfire,"The Bruler Fire was detected on July 12, 2021 and is located near the...",OREGON,2021-07-27 12:22:53,44.591,-122.156,195 Acres,/incident/7663/,7663,53
Summit Fire,Wildfire,The Summit Fire was ignited by lightning during summer thunderstorms...,CALIFORNIA,2021-07-27 12:22:42,38.629,-120.04,22 Acres,/incident/7711/,7711,100
Robertson Draw,Wildfire,The Robertson Draw Fire started at approximately 2:17 P.M. on Sunday...,MONTANA,2021-07-27 12:21:29,45.015,-109.253,"29,885 Acres",/incident/7537/,7537,90
Hay Creek,Wildfire,"The Hay Creek Fire was reported Wednesday evening, July 21, 2021,...",MONTANA,2021-07-27 12:19:06,48.778,-114.431,"1,158 Acres",/incident/7712/,7712,0
West Lolo Complex,Wildfire,"Thunderstorms on July 7, 2021, started multiple wildfires across the...",MONTANA,2021-07-27 12:18:47,47.41,-114.988,"8,490 Acres",/incident/7620/,7620,0
Trail Creek Fire,Wildfire," The Trail Creek Fire started on July 8, 2021 approximately 20 miles...",MONTANA,2021-07-27 12:12:07,45.683,-113.854,"32,933 Acres",/incident/7634/,7634,0
Anderson Hill Fire,Wildfire,This fire originated in Granite County one mile southeast of Garnet...,MONTANA,2021-07-27 12:10:29,46.818,-113.334,750 Acres,/incident/7671/,7671,90
Alder Creek Fire,Wildfire,"The Alder Creek Fire started on July 8, 2021 approximately 7 miles...",MONTANA,2021-07-27 12:07:23,45.79,-113.101,"8,849 Acres",/incident/7641/,7641,10
Cub Creek 2 Fire,Wildfire,"The Cub Creek 2 Fire started on July 16, 2021, at 1:27 PM. It's...",WASHINGTON,2021-07-27 12:06:54,48.551,-120.194,"51,168 Acres",/incident/7675/,7675,11
Divide Complex-Ellis Fire,Wildfire,"The Ellis Fire, which is being managed as part of the Divide Complex...",MONTANA,2021-07-27 12:03:24,46.838,-111.272,"1,277 Acres",/incident/7625/,7625,70
Morgan Creek Fire,Wildfire, The Morgan Creek Fire was reported on July 9 on the Routt National...,COLORADO,2021-07-27 11:52:36,40.718,-106.829,"6,093 Acres",/incident/7635/,7635,8
Stateline Complex,Wildfire,"The Stateline Fire Complex is located Southwest of St. Regis,...",IDAHO,2021-07-27 11:45:33,47.17,-115.442,"3,271 Acres",/incident/7627/,7627,3
Burnt Peak Fire,Wildfire,The Burnt Peak Fire started by lightning on the morning of July 7th...,MONTANA,2021-07-27 11:28:50,48.34,-115.968,"2,715 Acres",/incident/7619/,7619,31
South Yaak,Wildfire,"The South Yaak Fire was detected on July 13, 2021.  It is burning in...",MONTANA,2021-07-27 11:28:18,48.551,-115.93,"1,523 Acres",/incident/7696/,7696,10
Sherwood,Wildfire,"The Sherwood Fire is located about 2 miles Northeast of Wellpinit,...",WASHINGTON,2021-07-27 11:22:20,47.912,-117.986,"1,102 Acres",/incident/7713/,7713,30
Slough Grass,Wildfire,"The Slough Grass Fire was first reported Monday, July 19th around...",MONTANA,2021-07-27 11:19:21,45.745,-106.795,"9,170 Acres",/incident/7715/,7715,100
Sourdough Fire,Wildfire,"                Beaverhead County, Mont., November 1st,...",MONTANA,2021-07-27 11:11:49,44.666,-112.975,"5,811 Acres",/incident/7259/,7259,75
Christensen Fire ,Wildfire,"The Christensen Fire started on July 16, 2021 approximately 12 miles...",MONTANA,2021-07-27 11:10:40,45.781,-113.226,"4,891 Acres",/incident/7702/,7702,0
Tango Fire,Wildfire,The lightning caused Tango Fire was reported the evening of July...,IDAHO,2021-07-27 11:10:17,44.483,-114.873,103 Acres,/incident/7706/,7706,0
Black Mountain,Wildfire,The lightning-caused Black Mountain fire was reported to the Dillon...,MONTANA,2021-07-27 11:06:42,45.185,-113.474,968 Acres,/incident/7691/,7691,0
Storm Theatre Complex,Wildfire,The Storm Theatre Complex is being managed by Incident Commander...,IDAHO,2021-07-27 11:06:39,46.555,-115.097,"7,915 Acres",/incident/7724/,7724,0
Chuweah Creek,Wildfire," The Chuweah Creek Fire started on July 12 outside of Nespelem,",WASHINGTON,2021-07-27 10:57:13,48.229,-119.017,"36,820 Acres",/incident/7664/,7664,65
Goose Fire,Wildfire,"The Goose Fire started on July 1, 2021 32 miles SSE of Ennis, MT near...",MONTANA,2021-07-27 10:53:15,44.733,-111.6,"7,496 Acres",/incident/7618/,7618,78
Cougar Rock Complex,Wildfire,The Cougar Rock Complex is comprised of several wildfires that all...,IDAHO,2021-07-27 10:51:48,46.893,-115.846,"6,741 Acres",/incident/7640/,7640,46
Club Fire,Wildfire,The Club Creek Fire started 3 miles southwest of Root Ranch. Crews...,IDAHO,2021-07-27 10:47:31,45.28,-115.055,178 Acres,/incident/7704/,7704,0
"Mud Lick, Haynes, and Iron Fires",Wildfire,On July 21st at 6 a.m. Tony DeMasters Great Basin Team 2 took command...,IDAHO,2021-07-27 10:39:56,45.183,-114.421,"18,031 Acres",/incident/7638/,7638,0
Bootleg Fire,Wildfire,The Bootleg Fire continues to burn actively on the Fremont-Winema...,OREGON,2021-07-27 10:33:56,42.616,-121.421,"410,731 Acres",/incident/7609/,7609,53
Shale Creek,Wildfire,Shale Creek Fire is located in remote and rugged terrain east of Hams...,WYOMING,2021-07-27 10:28:03,42.236,-110.606,189 Acres,/incident/7689/,7689,60
Snake River Complex,Wildfire,The Snake River Complex comprises of three wildfires that merged...,IDAHO,2021-07-27 10:21:26,46.012,-116.911,"108,794 Acres",/incident/7636/,7636,85
Harris Mountain,Wildfire,Evening Update - 7.26.2021 at 8:00 PMFire activity picked up in the...,MONTANA,2021-07-27 10:20:35,47.127,-111.75,"19,103 Acres",/incident/7719/,7719,0
Goddard Road Fire,Wildfire,The Goddard Road Fire has been returned to the local district (DNR)...,WASHINGTON,2021-07-27 09:49:29,48.447,-118.152,815 Acres,/incident/7676/,7676,100
Spruce Canyon,Wildfire,Our Northeast Washington Interagency Type 3 IMT Team 2 were stood up...,WASHINGTON,2021-07-27 09:36:09,48.54,-117.593,67 Acres,/incident/7721/,7721,10
Muddy Slide Fire,Wildfire,"Muddy Slide Fire Update Sunday, July 25 2021The Muddy Slide Fire...",COLORADO,2021-07-27 09:14:32,40.143,-106.798,"4,093 Acres",/incident/7566/,7566,70
Crater Ridge,Wildfire,The Crater Ridge Fire ignited on July 17 in a remote area of the...,WYOMING,2021-07-27 08:58:00,44.947,-107.771,641 Acres,/incident/7685/,7685,0
Ruby,Wildfire," The Ruby Fire was detected on July 15, 2021 at 6:40 p.m.  It is...",MONTANA,2021-07-27 08:53:48,48.484,-115.94,86 Acres,/incident/7698/,7698,95
Peak Fire,Wildfire,The Bureau of Land Management and U.S. Forest Service are in Unified...,CALIFORNIA,2021-07-27 08:35:11,35.406,-118.436,"2,098 Acres",/incident/7703/,7703,87
Vinegar Fire,Wildfire,The Vinegar Fire started approximately 2 miles north of the Cabin...,IDAHO,2021-07-27 07:45:06,45.179,-114.905,"1,045 Acres",/incident/7709/,7709,0
Rush Creek,Wildfire,The Rush Creek Fire started at the confluence of Telephone and Rush...,IDAHO,2021-07-27 07:42:09,44.983,-114.993,"1,779 Acres",/incident/7710/,7710,0
2021 Payette Wilderness Fires,Wildfire,Three fires are burning in the Frank Church River of No Return...,IDAHO,2021-07-27 07:18:40,45,-115,"3,002 Acres",/incident/7700/,7700,0
Elbow Creek,Wildfire,"The Elbow Creek Fire, located approximately 17 miles northwest of...",OREGON,2021-07-26 23:18:35,45.867,-117.619,"22,790 Acres",/incident/7672/,7672,38
Nez Perce-Clearwater Lightning Fires,Wildfire,"In early July, a thunderstorm system moved through the north-central...",IDAHO,2021-07-26 21:37:13,46.245,-116.033,0 Acres,/incident/7692/,7692,0
Granite Pass Complex,Wildfire,Follow the Granite Pass Complex on Facebook The Granite Pass Complex...,MONTANA,2021-07-26 20:25:45,46.652,-114.591,"3,726 Acres",/incident/7653/,7653,22
Dry Cabin,Wildfire,"The Dry Cabin Fire was reported at 1:37 p.m. on July 11, 2021. It is...",MONTANA,2021-07-26 19:20:45,47.278,-112.956,"2,370 Acres",/incident/7660/,7660,0
Fly,Wildfire,The Fly Fire merged with the Dixie Fire on the night of July 24/25. ...,CALIFORNIA,2021-07-26 19:05:12,40.007,-120.965,0 Acres,/incident/7716/,7716,0
Hardesty Valley Fire,Wildfire,The Hardesty Valley fire was transitioned over to the Southern Area...,WASHINGTON,2021-07-26 17:31:49,46.945,-117.368,30 Acres,/incident/7725/,7725,30
Nelson Creek Fire,Wildfire,Fire activity was active on Sunday afternoon with two new fires...,WASHINGTON,2021-07-26 17:10:21,47.998,-117.229,154 Acres,/incident/7723/,7723,60
Animas City Mountain Prescribed Burn,Prescribed Fire," In order to reduce the risk of high-intensity wildfire, improve...",COLORADO,2021-07-26 17:03:24,37.323,-107.872,0 Acres,/incident/7688/,7688,0
Trestle Creek Complex,Wildfire,"July 7, lightning came through the area starting 7 fires.  Two fires...",IDAHO,2021-07-26 14:57:55,48.341,-116.22,436 Acres,/incident/7648/,7648,37
West Zone Superior Fires,Wildfire," The West Zone of the Superior National Forest, consisting of the...",MINNESOTA,2021-07-26 14:48:13,47.907,-91.831,0 Acres,/incident/7617/,7617,0
Dexter Fire,Wildfire,The lightning-caused Dexter Fire was reported at 9:35 a.m....,CALIFORNIA,2021-07-26 14:22:27,37.802,-118.874,"2,965 Acres",/incident/7656/,7656,97
Glacier Fire,Wildfire,The lightning-caused Glacier Fire was reported on 1:18 p.m. on...,CALIFORNIA,2021-07-26 13:33:20,37.145,-118.42,41 Acres,/incident/7668/,7668,100
Lukens,Wildfire,The Lukens Fire is one of multiple fires burning in Yosemite National...,CALIFORNIA,2021-07-26 12:47:16,37.851,-119.618,466 Acres,/incident/7614/,7614,50
Beckwourth  Complex,Wildfire, Incident Commander Bryce Thomas is leading the Type 3 Organization...,CALIFORNIA,2021-07-26 12:23:52,39.875,-120.368,"105,670 Acres",/incident/7601/,7601,98
Larkins Fire Complex,Wildfire,The Larkins Fire Complex is located on the St. Joe River Ranger...,IDAHO,2021-07-26 12:17:03,46.967,-115.671,"2,500 Acres",/incident/7722/,7722,0
Steptoe Canyon,Wildfire," The Steptoe Canyon Fire started on July 22, 2021 at approximately...",WASHINGTON,2021-07-26 12:13:19,46.49,-117.2,"2,605 Acres",/incident/7717/,7717,100
Northrup,Wildfire," At about 5:00 p.m. July 22, fire resources responded to a call for...",WASHINGTON,2021-07-26 11:40:23,47.859,-119.098,247 Acres,/incident/7718/,7718,95
King,Wildfire,There are multiple fires burning in Yosemite National Park...,CALIFORNIA,2021-07-26 10:51:09,37.702,-119.533,10 Acres,/incident/7593/,7593,100
2021 Humboldt-Toiyabe Initial Attack,Wildfire,For all emerging initial attack incidents on the Humboldt-Toiyabe...,NEVADA,2021-07-26 10:50:28,39.524,-119.719,1 Acres,/incident/7304/,7304,0
Spring Prescribed Fire Projects 2021,Prescribed Fire,Please take a moment to at the links section of this page to see...,OREGON,2021-07-26 10:38:38,44.418,-118.952,0 Acres,/incident/7426/,7426,0
Sylvan Fire,Wildfire,People visiting Sylvan Lake State Park and other open areas near the...,COLORADO,2021-07-26 10:36:00,39.465,-106.768,"3,792 Acres",/incident/7562/,7562,68
Half Moon,Wildfire,There are multiple fires burning in Yosemite National Park...,CALIFORNIA,2021-07-26 10:16:07,37.893,-119.552,1 Acres,/incident/7670/,7670,0
County Line,Wildfire,The County Line Fire is one of multiple fires burning in Yosemite...,CALIFORNIA,2021-07-26 10:12:10,37.835,-119.619,224 Acres,/incident/7613/,7613,100
Hoover,Wildfire,The Hoover Fire is one of multiple fires burning in Yosemite National...,CALIFORNIA,2021-07-26 09:13:00,37.654,-119.489,59 Acres,/incident/7701/,7701,100
Silliman,Wildfire,"Discovered on July 21, 2021, the lightning-caused Silliman is burning...",CALIFORNIA,2021-07-26 09:10:17,36.641,-118.719,4 Acres,/incident/7714/,7714,100
Lost Fire,Wildfire,"Discovered on July 10, 2021, the lightning-caused Lost Fire is...",CALIFORNIA,2021-07-26 09:08:25,36.92,-118.707,101 Acres,/incident/7666/,7666,100
Delta Lake Fire ,Wildfire,The Delta Lake Fire continues to be the only active fire within the...,MINNESOTA,2021-07-26 08:24:05,47.93,-91.74,62 Acres,/incident/7643/,7643,92
Graham Ridge Fire,Wildfire,"Overnight and into the morning of 7/7/21, a thunderstorm system moved...",IDAHO,2021-07-25 17:41:03,47.618,-116.141,15 Acres,/incident/7630/,7630,0
Lava Post-Fire BAER,Burned Area Emergency Response,THREE PHASES OF WILDFIRE RECOVERY There are three phases of recovery...,CALIFORNIA,2021-07-25 17:32:03,41.425,-122.261,0 Acres,/incident/7693/,7693,0
Lava Fire,Wildfire,The Lava Fire started on 6/24/21 by lightning and is burning...,CALIFORNIA,2021-07-25 17:01:43,41.459,-122.329,"26,316 Acres",/incident/7581/,7581,77
Salt Post-Fire BAER,Burned Area Emergency Response,THREE PHASES OF WILDFIRE RECOVERY There are three phases of recovery...,CALIFORNIA,2021-07-25 12:31:34,40.916,-122.403,0 Acres,/incident/7697/,7697,0
Tennant Post-Fire BAER,Burned Area Emergency Response, THREE PHASES OF WILDFIRE RECOVERY  There are three phases of...,CALIFORNIA,2021-07-23 14:37:53,41.733,-122.107,0 Acres,/incident/7699/,7699,0
Brewster Fire,Wildfire,"&amp;#183;Last update will be July 16, 2021 unless increased fire...",MONTANA,2021-07-23 13:30:42,46.612,-113.574,156 Acres,/incident/7629/,7629,85
McDougal Fire,Wildfire, The McDougal fire is currently assessed at 16.5 acres. Type 1 and...,MONTANA,2021-07-23 00:35:09,46.119,-113.451,17 Acres,/incident/7695/,7695,0
North,Wildfire,"On Thursday, July 8, 2021, an escaped campfire was reported on the...",CALIFORNIA,2021-07-22 16:49:46,37.76,-119.559,0 Acres,/incident/7623/,7623,100
Tiger Fire,Wildfire,This will be the final news release unless there are significant...,ARIZONA,2021-07-22 13:00:20,34.139,-112.218,"16,278 Acres",/incident/7595/,7595,90
Grandview,Wildfire,"The Grandview Fire was reported at 1:30 p.m., Sunday, July 11th,...",OREGON,2021-07-22 12:54:58,44.466,-121.4,"6,032 Acres",/incident/7651/,7651,95
Wegner,Wildfire, There are multiple fires burning in Yosemite National Park...,CALIFORNIA,2021-07-22 08:01:54,37.849,-119.552,0 Acres,/incident/7705/,7705,0
Porcupine,Wildfire,There are multiple fires burning in Yosemite National Park...,CALIFORNIA,2021-07-21 23:13:12,37.825,-119.552,10 Acres,/incident/7678/,7678,100
Stubblefield,Wildfire,There are multiple fires burning in Yosemite National Park...,CALIFORNIA,2021-07-21 23:12:10,38.059,-119.59,2 Acres,/incident/7669/,7669,0
Quartzite,Wildfire,There are multiple fires burning in Yosemite National Park...,CALIFORNIA,2021-07-21 23:02:42,37.702,-119.467,0 Acres,/incident/7612/,7612,100
Elements Fire,Wildfire,The Elements Fire was discovered on July 11 the result of area...,ARIZONA,2021-07-21 15:52:16,35.451,-114.083,"1,343 Acres",/incident/7652/,7652,100
Too Kush 2,Wildfire,"The Too Kush 2 wildfire was started by lightning on July 2, 2021. It...",IDAHO,2021-07-21 13:26:21,46.145,-115.907,"1,341 Acres",/incident/7659/,7659,90
Creek Fire,Wildfire,"CLOVIS, Calif., December 24, 2020 – For Immediate Release. With the...",CALIFORNIA,2021-07-21 11:52:38,37.201,-119.272,"379,895 Acres",/incident/7147/,7147,100
Backbone Post-Fire BAER,Burned Area Emergency Response,THREE PHASES OF WILDFIRE RECOVERY There are three phases of recovery...,ARIZONA,2021-07-20 21:13:03,34.377,-111.643,0 Acres,/incident/7602/,7602,0
Red Apple,Wildfire,The Red Apple Fire was first reported to RIVERCOM at 6:55 p.m. on...,WASHINGTON,2021-07-20 21:05:30,47.508,-120.426,"12,288 Acres",/incident/7667/,7667,90
Darlene,Wildfire,"The Darlene Fire was reported on private lands on July 13, 2021 at...",OREGON,2021-07-20 19:27:52,43.646,-121.474,686 Acres,/incident/7665/,7665,95
Salt Fire,Wildfire," July 20, 2021:      |     Maps    ...",CALIFORNIA,2021-07-20 09:27:47,40.849,-122.336,"12,660 Acres",/incident/7587/,7587,100
O'Connell Fire,Wildfire,"The fire was first reported on Monday, July 12th at 6 am that was...",ARIZONA,2021-07-19 18:37:37,36.003,-112.204,190 Acres,/incident/7661/,7661,100
Bear Fire,Wildfire,The Bear Fire started June 16 about 10 miles south of Hannigan...,ARIZONA,2021-07-19 14:07:56,33.458,-109.392,"24,067 Acres",/incident/7553/,7553,50
Park Lake Fire,Wildfire, A 3-5 acre fire is burning on the east side of Park Lake on the...,MONTANA,2021-07-19 12:01:21,46.448,-112.157,3 Acres,/incident/7673/,7673,0
Fork,Wildfire,There are multiple fires burning in Yosemite National Park...,CALIFORNIA,2021-07-18 14:09:52,37.702,-119.486,12 Acres,/incident/7610/,7610,100
Clark,Wildfire,There are multiple fires burning in Yosemite National Park...,CALIFORNIA,2021-07-18 12:00:29,37.686,-119.468,0 Acres,/incident/7611/,7611,100
MY Complex,Wildfire,"The MY Complex consists of three wildland fires reported on July 8,...",MONTANA,2021-07-17 07:17:51,46.254,-107.638,"27,811 Acres",/incident/7645/,7645,93
Lyle Hill,Wildfire," The Lyle Hill fire started just NE of Lyle, WA on July 12, 2021....",WASHINGTON,2021-07-16 20:33:30,45.698,-121.271,135 Acres,/incident/7662/,7662,90
Pinnacle Fire,Wildfire,"Pinnacle Fire 100% contained at 3PM July 16,",ARIZONA,2021-07-16 18:32:32,32.865,-110.201,"34,417 Acres",/incident/7523/,7523,100
Telegraph Post-Fire BAER,Burned Area Emergency Response,THREE PHASES OF WILDFIRE RECOVERY  There are three phases of...,ARIZONA,2021-07-16 14:47:09,33.174,-111.008,0 Acres,/incident/7560/,7560,0
Crooked Creek,Wildfire,THIS FIRE IS NO LONGER BEING UPDATED.The Crooked Creek Fire is...,MONTANA,2021-07-16 14:41:51,45.184,-108.42,"4,141 Acres",/incident/7542/,7542,85
Tennant ,Wildfire," YREKA, Calif, July, 10, 2021- As of 6 A.M. July 10th, the Tennant...",CALIFORNIA,2021-07-16 11:50:00,41.665,-122.039,"10,580 Acres",/incident/7584/,7584,100
Middle Fire,Wildfire,"The Middle Fire was first discovered on Tuesday, June 29, 2021, just...",ARIZONA,2021-07-15 20:06:34,34.217,-111.751,"2,792 Acres",/incident/7622/,7622,0
Cedar Basin Fire,Wildfire,"As of Thursday, July 15, 2021 the fire is 100% contained and all...",ARIZONA,2021-07-15 14:56:08,34.825,-113.391,734 Acres,/incident/7642/,7642,100
Cameron Peak Post-Fire BAER,Burned Area Emergency Response,"The Cameron Peak Fire was reported on Thursday, August 13 at...",COLORADO,2021-07-14 15:17:57,40.609,-105.679,0 Acres,/incident/7210/,7210,0
Williams Fork Post-Fire BAER,Burned Area Emergency Response,The Williams Fork Fire was first reported on Aug. 14 at approximately...,COLORADO,2021-07-14 15:03:09,39.783,-106,0 Acres,/incident/7211/,7211,0
East Troublesome Post-Fire BAER,Burned Area Emergency Response,The East Troublesome Fire was reported on the afternoon of October...,COLORADO,2021-07-14 15:02:57,40.25,-105.9,0 Acres,/incident/7267/,7267,0
Burbank,Wildfire,"The Burbank fire, located west of South Badger Pocket Road in Yakima...",WASHINGTON,2021-07-14 10:39:24,46.752,-120.388,"13,000 Acres",/incident/7650/,7650,98
Willow Fire,Wildfire,CURRENT CONDITIONS:The weather is expected to be hotter and dryer...,CALIFORNIA,2021-07-12 13:47:45,36.207,-121.56,"2,877 Acres",/incident/7549/,7549,100
Hassel Fire,Wildfire,"On July 7, 2021, the Astray wildfire was reported on the west zone of...",MINNESOTA,2021-07-12 11:14:46,47.931,-92.134,21 Acres,/incident/7511/,7511,100
Pack Creek,Wildfire,The Pack Creek Fire is 100% contained. Even though the fire is...,UTAH,2021-07-12 10:42:54,38.433,-109.343,"8,952 Acres",/incident/7529/,7529,100
Blue Fire,Wildfire,"The Blue Fire reported around 4:25 this 6/29/2021, with USFS and CAL...",CALIFORNIA,2021-07-12 10:35:10,37.033,-119.258,277 Acres,/incident/7585/,7585,100
S-503,Wildfire, The S-503 Fire is burning in timber and grasses on the Confederated...,OREGON,2021-07-12 10:23:22,45.087,-121.476,"6,822 Acres",/incident/7559/,7559,98
Rattlesnake Fire,Wildfire,"Rattlesnake Fire started on June 30, 2021 and is under a unified...",OREGON,2021-07-12 10:21:42,44.868,-121.07,"5,479 Acres",/incident/7592/,7592,98
Lewis Rock,Wildfire, Fire is burning on Oregon Department of Forestry protected lands...,OREGON,2021-07-11 23:12:20,44.506,-120.128,368 Acres,/incident/7604/,7604,95
Silcott Fire,Wildfire,The Silcott fire started in the area of Silcott Grade Road west of...,WASHINGTON,2021-07-11 14:42:28,46.376,-117.167,"8,633 Acres",/incident/7626/,7626,100
Rafael Fire ,Wildfire,"The Rafael Fire was discovered on June 18, 2021 on the Prescott...",ARIZONA,2021-07-11 12:28:35,34.942,-112.162,"78,065 Acres",/incident/7567/,7567,95
Batterman RD,Wildfire," The Batterman Road Fire started on July 4, 2021 at approximately...",WASHINGTON,2021-07-09 22:24:03,47.409,-120.176,"14,100 Acres",/incident/7603/,7603,100
Bottom Fire,Wildfire,"The Bottom Fire was discovered June 28th, approximately 7 miles west...",ARIZONA,2021-07-09 19:03:45,33.192,-110.261,"6,004 Acres",/incident/7586/,7586,95
Inyo Creek Fire,Wildfire,     Final Update     |     Maps     |   ...,CALIFORNIA,2021-07-09 12:43:27,36.583,-118.214,592 Acres,/incident/7564/,7564,100
Pine Fire,Wildfire,   Thanks to a quick response of firefighters from the Inyo National...,CALIFORNIA,2021-07-09 12:29:00,37.37,-118.679,24 Acres,/incident/7621/,7621,100
Johnson Fire,Wildfire,"The Johnson Fire is 88,918 acres and 75% contained. The fire will...",NEW MEXICO,2021-07-09 11:14:51,33.238,-108.473,"88,918 Acres",/incident/7493/,7493,75
Oil Springs Fire,Wildfire,"July 1, 2021The Oil Springs Fire is 97 percent contained as of the...",COLORADO,2021-07-06 16:20:41,39.744,-108.873,"12,613 Acres",/incident/7569/,7569,99
Mescal Fire,Wildfire," 6/18:  Crews will continue to hold and monitor containment lines,...",ARIZONA,2021-07-06 14:11:55,33.166,-110.664,"72,250 Acres",/incident/7507/,7507,100
Sunset Valley Fire,Wildfire, The Sunset Valley Fire that originally ran 987 acres in the course...,OREGON,2021-07-04 11:38:51,45.573,-121.115,987 Acres,/incident/7597/,7597,85
Wrentham Market,Wildfire,The Wrentham Market Fire began on 06/29 east of Dufur in Wasco...,OREGON,2021-07-04 11:38:39,45.49,-121.006,"7,222 Acres",/incident/7589/,7589,100
Mescal Post-Fire BAER,Burned Area Emergency Response,THREE PHASES OF WILDFIRE RECOVERY  There are three phases of...,ARIZONA,2021-07-03 23:04:24,33.114,-110.596,0 Acres,/incident/7573/,7573,0
Deep Creek Canyon Fire,Wildfire,  Wildfire Information Deep Creek Canyon FireTownsend Ranger...,MONTANA,2021-07-02 16:28:53,46.349,-111.165,"4,648 Acres",/incident/7536/,7536,98
Haystack,Wildfire,"On June 7th, the lightning caused Haystack Fire, located 18 miles...",ALASKA,2021-07-01 12:29:08,65.14,-147.604,927 Acres,/incident/7548/,7548,100
Magic Feather Prescribed Burn,Prescribed Fire," &amp;#183;Firefighters monitored the Magic Feather Prescribed Burn, east...",COLORADO,2021-06-30 13:51:11,40.764,-105.542,"6,329 Acres",/incident/6403/,6403,0
Rock Butte Fires ,Wildfire,&gt;&gt;DAILY ROCK BUTTE FIRES UPDATESROCK BUTTE FIRES - Multiple fires...,ARIZONA,2021-06-28 22:11:13,34.995,-112.432,802 Acres,/incident/7556/,7556,80
Wild Cow Fire,Wildfire,"June 28, 2021This is the final update for the Wild Cow Fire.  The...",COLORADO,2021-06-28 18:57:39,39.525,-108.908,560 Acres,/incident/7575/,7575,100
Cutoff Fire,Wildfire,"The Cutoff Fire is currently burning on private, Fremont-Winema...",OREGON,2021-06-28 11:02:50,42.285,-121.402,"1,288 Acres",/incident/7561/,7561,96
